{
  "domain": "maritime-rescue-transfer",
  "version": 2,
  "sample_id": "record-009",
  "title": "渔船出海安全闭环",
  "actors": [
    "船主",
    "船员",
    "值班员",
    "海警检查员",
    "渔政检查员",
    "海事检查员",
    "系统"
  ],
  "facts": [
    "港口每天面对大量船舶，口头提醒无法阻止同一艘船带着未修复缺陷再次离港",
    "检查照片与仪器结果必须带采集时间，作为证据留存",
    "复检只能追加结论，不能覆盖或删除原始检查记录",
    "船员临时更换、设备借用、海况预报升级、跨港转场和系统断网，均不能绕过未关闭缺陷",
    "多部门对同一船舶的重复检查应归并为同一检查事件，但按部门和检查员分别保留责任",
    "船主在离港前能提前看到阻断离港的具体事项及所缺证据",
    "值班员只在证据齐全、阻断事项全部关闭后放行",
    "航行期间失联或偏离计划时自动进入联系与逐级升级流程",
    "返港后可用实际事件反向改进检查规则，规则修订保留版本"
  ],
  "records": [
    "船舶证照",
    "船员清单",
    "海况预报",
    "动力检查",
    "通信测试",
    "救生衣状态",
    "救生筏状态",
    "缺陷整改与复检",
    "离港许可"
  ],
  "stages": [
    "出海前：核验船舶证照、登记船员清单并接收海况预报",
    "检查：动力、通信、救生衣、救生筏逐项检查，照片与仪器结果带采集时间",
    "整改：缺陷登记后整改，复检结论只能追加",
    "放行：值班员核对阻断事项全部关闭且证据齐全后签发离港许可",
    "航行：按计划保持联络，失联或偏离计划自动联系与升级",
    "返港：以实际事件复盘并反向改进检查规则"
  ],
  "blocking_scenarios": [
    "船员临时更换",
    "设备借用",
    "海况预报升级",
    "跨港转场",
    "系统断网离线采集"
  ],
  "constraints": [
    "存在未关闭缺陷时不得签发离港许可",
    "船员临时更换、设备借用、预报升级、跨港转场和断网离线均不得绕过未关闭缺陷，离线操作联网后必须补核对",
    "复检只能追加结论，原始检查与历次复检全部保留",
    "多部门重复检查归并为一次检查事件，同时按部门和检查员保留各自责任",
    "船主可见阻断离港的具体事项及缺失证据",
    "证据不齐全时值班员无权放行",
    "失联或偏离计划必须自动触发联系并逐级升级，全过程留痕",
    "检查规则修订须来源于返港事件复盘，保留历史版本"
  ],
  "escalation": [
    "超过约定联络时间未应答：系统自动重试联系船舶、船主与登记船员",
    "持续失联或偏离航行计划：升级至值班长并通报海警",
    "每次联系与升级均记录时间、对象、方式与结果"
  ],
  "feedback_loop": "返港后将失联、偏航、设备故障等实际事件关联到对应检查项，提出检查规则修订；修订生效后只作用于新的检查周期，历史检查按旧版本可追溯"
}
